{
  "checks": {
    "correctness": true,
    "retained_storage_headroom": true,
    "rss_headroom": true,
    "storage_headroom": true,
    "time_headroom": true,
    "transient_storage_headroom": true
  },
  "claim": "engineering_evidence_only",
  "decision": "admitted",
  "enforced_checks": [
    "time_headroom",
    "rss_headroom",
    "retained_storage_headroom",
    "transient_storage_headroom",
    "storage_headroom",
    "correctness"
  ],
  "headroom": {
    "rss_fraction": 0.2,
    "storage_fraction": 0.15000086123448114,
    "time_fraction": 0.2
  },
  "limits": {
    "rss_bytes": 4294967296,
    "volume_bytes": 749064527872,
    "wall_seconds": 14400
  },
  "native_capacity": {
    "free_bytes": 749064527872,
    "reserved_headroom_bytes": 112360324301
  },
  "projected": {
    "logical_read_bytes": 968221590,
    "logical_write_bytes": 756089851,
    "peak_rss_bytes": 1230974976,
    "physical_read_bytes": 15344418816,
    "physical_write_bytes": 10927951872,
    "publication_work_units": 9800,
    "reader_calls": 16067,
    "retained_storage_bytes": 2886062080,
    "storage_peak_bytes": 3641536512,
    "transient_peak_storage_bytes": 3641536512,
    "wall_seconds": 58
  },
  "rss_growth_fraction": 0.432428407433837,
  "schema": "graphforge-progressive-qualification-evidence/1",
  "slopes_observed": {
    "logical_read_bytes": 248266645,
    "logical_write_bytes": 193777976,
    "physical_read_bytes": 3910328320,
    "physical_write_bytes": 2784153600,
    "publication_work_units": 2483,
    "reader_calls": 4126
  },
  "source_scales": [
    18,
    19
  ],
  "target": "S20"
}
